{
  "approver_id": "project-owner-current-user",
  "attested_at": "2026-09-25T04:53:54Z",
  "authentication": {
    "confirmation_sha256": "sha256:93ddf26362680857696269cba2fe68100b83f07bfc0abef6fa877e8c009ab6b0",
    "limitation": "manual identity and independence verification is not cryptographically replayable",
    "mode": "manual-trusted-channel"
  },
  "gate": "P04",
  "kind": "arop-user-gate-summary",
  "raw_evidence_sha256": "sha256:35ee0dbe6a28a45bb3216768d3f40f5f386b73ca70fa4afa72b7c31c958ad4f9",
  "result": {
    "must_fix": [],
    "must_fix_count": 0,
    "phases": [
      {
        "id": "P01",
        "result": "PASS"
      },
      {
        "id": "P02",
        "result": "PASS"
      },
      {
        "id": "P03",
        "result": "PASS"
      },
      {
        "id": "P04",
        "result": "PASS"
      },
      {
        "id": "P05",
        "result": "PASS"
      },
      {
        "id": "P06",
        "result": "PASS"
      },
      {
        "id": "P07",
        "result": "PASS"
      },
      {
        "id": "P08",
        "result": "PASS"
      },
      {
        "id": "P09",
        "result": "PASS"
      },
      {
        "id": "P10",
        "result": "PASS"
      },
      {
        "id": "P11",
        "result": "PASS"
      },
      {
        "id": "P12",
        "result": "PASS"
      },
      {
        "id": "P13",
        "result": "PASS"
      },
      {
        "id": "P14",
        "result": "PASS"
      },
      {
        "id": "P15",
        "result": "PASS"
      },
      {
        "id": "P16",
        "result": "PASS"
      },
      {
        "id": "P17",
        "result": "PASS"
      },
      {
        "id": "P18",
        "result": "PASS"
      },
      {
        "id": "P19",
        "result": "PASS"
      },
      {
        "id": "P20",
        "result": "PASS"
      },
      {
        "id": "P21",
        "result": "PASS"
      },
      {
        "id": "P22",
        "result": "PASS"
      },
      {
        "id": "P23",
        "result": "PASS"
      },
      {
        "id": "P24",
        "result": "PASS"
      },
      {
        "id": "P25",
        "result": "PASS"
      },
      {
        "id": "P26",
        "result": "PASS"
      },
      {
        "id": "P27",
        "result": "PASS"
      },
      {
        "id": "P28",
        "result": "PASS"
      },
      {
        "id": "P29",
        "result": "PASS"
      },
      {
        "id": "P30",
        "result": "PASS"
      },
      {
        "id": "P31",
        "result": "PASS"
      },
      {
        "id": "P32",
        "result": "PASS"
      },
      {
        "id": "P33",
        "result": "PASS"
      },
      {
        "id": "P34",
        "result": "PASS"
      },
      {
        "id": "P35",
        "result": "PASS"
      },
      {
        "id": "P36",
        "result": "PASS"
      },
      {
        "id": "P37",
        "result": "PASS"
      },
      {
        "id": "P38",
        "result": "PASS"
      },
      {
        "id": "P39",
        "result": "PASS"
      },
      {
        "id": "P40",
        "result": "PASS"
      },
      {
        "id": "P41",
        "result": "PASS"
      },
      {
        "id": "P42",
        "result": "PASS"
      },
      {
        "id": "P43",
        "result": "PASS"
      },
      {
        "id": "P44",
        "result": "PASS"
      },
      {
        "id": "P45",
        "result": "PASS"
      },
      {
        "id": "P46",
        "result": "PASS"
      },
      {
        "id": "P47",
        "result": "PASS"
      },
      {
        "id": "P48",
        "result": "PASS"
      },
      {
        "id": "P49",
        "result": "PASS"
      },
      {
        "id": "P50",
        "result": "PASS"
      },
      {
        "id": "P51",
        "result": "PASS"
      },
      {
        "id": "P52",
        "result": "PASS"
      },
      {
        "id": "P53",
        "result": "PASS"
      }
    ],
    "requirements": [
      {
        "id": "IR-01",
        "result": "PASS"
      },
      {
        "id": "IR-02",
        "result": "PASS"
      },
      {
        "id": "IR-03",
        "result": "PASS"
      },
      {
        "id": "IR-04",
        "result": "PASS"
      },
      {
        "id": "IR-05",
        "result": "PASS"
      },
      {
        "id": "IR-06",
        "result": "PASS"
      },
      {
        "id": "IR-07",
        "result": "PASS"
      },
      {
        "id": "IR-08",
        "result": "PASS"
      },
      {
        "id": "IR-09",
        "result": "PASS"
      },
      {
        "id": "IR-10",
        "result": "PASS"
      },
      {
        "id": "IR-11",
        "result": "PASS"
      },
      {
        "id": "IR-12",
        "result": "PASS"
      },
      {
        "id": "IR-13",
        "result": "PASS"
      },
      {
        "id": "IR-14",
        "result": "PASS"
      }
    ],
    "should_fix": [],
    "should_fix_count": 0,
    "verdict": "PASS"
  },
  "schema_version": 1,
  "subject": {
    "artifact_manifest_sha256": "f2d21c54fcc67870b0b601969546bf6498b890e3efd69a7349bf53bc91c64fdd",
    "blueprint_sha256": "2c8470f94220c4959c98e91f3909bd3d698c265841c5be9e53afaab84ced0a94",
    "commit": "ff401560339f8c52182e48f10f300f259432a3e6",
    "plan_last_phase": "P53",
    "plan_sha256": "127e29a4ea740db9a91e2720f9c3f08d1a04e0346d445b522b5957bb4dbbf4e5",
    "planning_audit_promoted_file_sha256": "sha256:37397a52857117662d2d6afcd3c1ecdfccbf6e3a75f4b9d636c72e68facdb510",
    "planning_audit_promoted_jcs_sha256": "sha256:f302e20c0c7ced4afe93f140fb4a9234a3f4dc375e6152688785bffcb0f6d404",
    "planning_audit_summary_sha256": "sha256:bd9feae0b2060932fbd990cdb0f340644101e1ca573941a3c3c5b6a572c05801",
    "requirements_sha256": "3154db5e7d9073967c67ec0669e442df9c225f39d79ea384a7c9da42bb8bb5e4"
  },
  "summary_sha256": "sha256:a378fc78920e99e6079feb2e4e2c16a248fa708a7649ba55aec42f9058cb8505"
}
