{
  "attested_at": "2026-09-24T01:29:49Z",
  "authentication": {
    "confirmation_sha256": "sha256:0d473c02985c6e6fa5efcee3a676a06c6251092e5abb4872f3e5a533b8acc509",
    "limitation": "manual identity and independence verification is not cryptographically replayable",
    "mode": "manual-trusted-channel"
  },
  "kind": "arop-planning-audit-summary",
  "raw_evidence_sha256": "sha256:46d420bb42e3aaaa359f14315139a1247bcb3a251b064db65e55356d18cd20ad",
  "result": {
    "must_fix": [],
    "must_fix_count": 0,
    "phases": [
      {
        "id": "P01",
        "result": "PASS"
      },
      {
        "id": "P02",
        "result": "PASS"
      },
      {
        "id": "P03",
        "result": "PASS"
      },
      {
        "id": "P04",
        "result": "PASS"
      },
      {
        "id": "P05",
        "result": "PASS"
      },
      {
        "id": "P06",
        "result": "PASS"
      },
      {
        "id": "P07",
        "result": "PASS"
      },
      {
        "id": "P08",
        "result": "PASS"
      },
      {
        "id": "P09",
        "result": "PASS"
      },
      {
        "id": "P10",
        "result": "PASS"
      },
      {
        "id": "P11",
        "result": "PASS"
      },
      {
        "id": "P12",
        "result": "PASS"
      },
      {
        "id": "P13",
        "result": "PASS"
      },
      {
        "id": "P14",
        "result": "PASS"
      },
      {
        "id": "P15",
        "result": "PASS"
      },
      {
        "id": "P16",
        "result": "PASS"
      },
      {
        "id": "P17",
        "result": "PASS"
      },
      {
        "id": "P18",
        "result": "PASS"
      },
      {
        "id": "P19",
        "result": "PASS"
      },
      {
        "id": "P20",
        "result": "PASS"
      },
      {
        "id": "P21",
        "result": "PASS"
      },
      {
        "id": "P22",
        "result": "PASS"
      },
      {
        "id": "P23",
        "result": "PASS"
      },
      {
        "id": "P24",
        "result": "PASS"
      },
      {
        "id": "P25",
        "result": "PASS"
      },
      {
        "id": "P26",
        "result": "PASS"
      },
      {
        "id": "P27",
        "result": "PASS"
      },
      {
        "id": "P28",
        "result": "PASS"
      },
      {
        "id": "P29",
        "result": "PASS"
      },
      {
        "id": "P30",
        "result": "PASS"
      },
      {
        "id": "P31",
        "result": "PASS"
      },
      {
        "id": "P32",
        "result": "PASS"
      },
      {
        "id": "P33",
        "result": "PASS"
      },
      {
        "id": "P34",
        "result": "PASS"
      },
      {
        "id": "P35",
        "result": "PASS"
      },
      {
        "id": "P36",
        "result": "PASS"
      },
      {
        "id": "P37",
        "result": "PASS"
      },
      {
        "id": "P38",
        "result": "PASS"
      },
      {
        "id": "P39",
        "result": "PASS"
      },
      {
        "id": "P40",
        "result": "PASS"
      },
      {
        "id": "P41",
        "result": "PASS"
      },
      {
        "id": "P42",
        "result": "PASS"
      },
      {
        "id": "P43",
        "result": "PASS"
      },
      {
        "id": "P44",
        "result": "PASS"
      },
      {
        "id": "P45",
        "result": "PASS"
      },
      {
        "id": "P46",
        "result": "PASS"
      },
      {
        "id": "P47",
        "result": "PASS"
      },
      {
        "id": "P48",
        "result": "PASS"
      },
      {
        "id": "P49",
        "result": "PASS"
      },
      {
        "id": "P50",
        "result": "PASS"
      },
      {
        "id": "P51",
        "result": "PASS"
      },
      {
        "id": "P52",
        "result": "PASS"
      },
      {
        "id": "P53",
        "result": "PASS"
      }
    ],
    "requirements": [
      {
        "id": "IR-01",
        "result": "PASS"
      },
      {
        "id": "IR-02",
        "result": "PASS"
      },
      {
        "id": "IR-03",
        "result": "PASS"
      },
      {
        "id": "IR-04",
        "result": "PASS"
      },
      {
        "id": "IR-05",
        "result": "PASS"
      },
      {
        "id": "IR-06",
        "result": "PASS"
      },
      {
        "id": "IR-07",
        "result": "PASS"
      },
      {
        "id": "IR-08",
        "result": "PASS"
      },
      {
        "id": "IR-09",
        "result": "PASS"
      },
      {
        "id": "IR-10",
        "result": "PASS"
      },
      {
        "id": "IR-11",
        "result": "PASS"
      },
      {
        "id": "IR-12",
        "result": "PASS"
      },
      {
        "id": "IR-13",
        "result": "PASS"
      },
      {
        "id": "IR-14",
        "result": "PASS"
      }
    ],
    "should_fix": [],
    "should_fix_count": 0,
    "verdict": "PASS"
  },
  "reviewer_id": "gms@backend:ts1093/codex",
  "schema_version": 1,
  "subject": {
    "artifact_manifest_sha256": "689fe010cb8903570dc7f76c116b1ad2d496b42eb150b99232d2adfe7ac91f87",
    "blueprint_sha256": "2c8470f94220c4959c98e91f3909bd3d698c265841c5be9e53afaab84ced0a94",
    "commit": "7498f8f9654d251cb2d8d8062d8d7c7f5d0373fc",
    "plan_last_phase": "P53",
    "plan_sha256": "127e29a4ea740db9a91e2720f9c3f08d1a04e0346d445b522b5957bb4dbbf4e5",
    "requirements_sha256": "3154db5e7d9073967c67ec0669e442df9c225f39d79ea384a7c9da42bb8bb5e4"
  },
  "summary_sha256": "sha256:b6decf940bb25a8eeac9c26077d042b9d8c120a567b0c6ad2da8d704605e0f4a"
}
